role,content
user,"Hello, world!"
assistant,Hello there! How can I assist you today?
user,How to effectively use large language models in daily work?
assistant,"Large language models have become increasingly popular and useful in many areas of daily work, such as natural language processing, chatbots, content creation, and data analysis. Here are some tips on how to effectively use large language models:

1. Choose the right model: Different language models are optimized for different tasks, so it's important to choose the model that fits your use case. Consider factors such as the size of your dataset, the complexity of the language you are working with, and the goals of your project.

2. Fine-tune the model: Most large language models are pre-trained on enormous amounts of text data, but fine-tuning the model on your specific domain can help it produce better results for your use case. Fine-tuning involves training the model on new data or with new parameters to customize it for specific tasks.

3. Understand the limitations: While large language models can produce impressive results, they're not perfect. Understanding the limitations of the model can help you avoid over-reliance and unrealistic expectations. Also, be mindful of ethical and responsible use of the models, as they can reinforce biases and stereotypes if not used carefully.

4. Experiment with inputs and outputs: Large language models are highly versatile, and experimenting with different inputs and outputs can reveal new and creative use cases. For example, using a text generation model to generate product descriptions or using a chatbot model to generate dialogue for customer service interactions.

5. Use appropriate tools and resources: Large language models require powerful hardware and specialized software to run efficiently. Also, keep up with latest research and resources to stay up-to-date. 

By following these tips, you can more effectively leverage large language models in your daily work and achieve better results."
user,"That's great advice, thanks!"
assistant,"You're welcome! If you have any more questions or need further assistance, feel free to ask."
